,Tweet_id,Tweet_user_followers,Tweet_user_following,Tweet_time,Tweet_content,Tweet_like_count,Tweet_retweet_count,Tweet_reply_count
851,986400594570153984,238785,490,2018-04-18 00:26:42,"@davehallnyc Hello Dave, we apologize for this experience. If you can kindly DM your contact details we will be happy to help.",0,0,2
852,989488841345118209,238785,490,2018-04-26 12:58:18,"@FlyJunkie_Sb Hello, we are sorry for this experience. We would recommend contacting our Customer Care team to best assist you at 1-800-458-1552 or vcnacare@volvoforlife.com",1,0,0
853,986643532227194880,238785,490,2018-04-18 16:32:03,A car so outstanding the world took notice.  The new #XC60 is The 2018 World Car of the Year and 2018 North American Utility Vehicle of the Year™,81,19,4
854,990764246236581889,238785,490,2018-04-30 01:26:18,"“(The #XC40 is) the most unique, useful, comfortable, and just plain creative vehicle we’ve driven in a long time” - @outsidemagazine",80,18,2
855,991337597887762432,238785,490,2018-05-01 15:24:36,"@BenGaut Hi Ben, thank you for your interest in these concepts. The XC40 at this time is not available as a plug in hybrid. We hope to have more information on this vehicle in the next coming months.",2,0,1
856,990766782930718722,238785,490,2018-04-30 01:36:23,"@mommadabest In addition to buying and leasing a car you can now subscribe- one flat monthly payment. Please visit  for more info but the plan is all included - even insurance, not taxes &amp; gas. Plus it’s for two years with an upgrade after one year like a cellphone.",1,0,1
857,990764717017837568,238785,490,2018-04-30 01:28:10,@JijiNakaba @stryda03 The first orders will be delivered in May,3,2,2
858,987050110348681218,238785,490,2018-04-19 19:27:39,@tenjake We are sorry to hear of this experience. If you can DM us your contact information we would be happy to follow up on your order.,2,0,0
859,980581813893595137,238785,490,2018-04-01 23:04:57,"@ShopNSushi Hello Liz, we are sorry for the experience you are having with your Volvo. If you can kindly DM us your contact information, we will have someone from our Customer Care team reach you to assist further.",2,0,0
860,984858520142188544,238785,490,2018-04-13 18:19:03,It's just a wireless charging mat. The new #XC40. Designed with every thing in mind.	Discover more at,34,12,5
861,983332014697996288,238785,490,2018-04-09 13:13:16,Discover a seamless new alternative to owning or leasing a car with #CarebyVolvo  learn more at,22,8,2
862,983725821805432832,238785,490,2018-04-10 15:18:07,It’s just a simple hook. 	The new #XC40 Designed with every thing in mind.,43,4,4
863,985265189166698500,238785,490,2018-04-14 21:15:01,Z is for Victory. Welcome to Zlatan. @ibra_official #zLAtan #ibrahimovic,349,44,6
864,981162794757140480,238785,490,2018-04-03 13:33:34,Introducing the new #XC40. The car you can subscribe to at,31,17,0
865,981603334816747520,238785,490,2018-04-04 18:44:06,"@UVAlison Hi Alie, we are sorry for any inconvenience this may cause. If you can kindly DM us your contact information, we will have our concierge team follow up with you regarding your order.",0,0,1
866,979791756786044929,238785,490,2018-03-30 18:45:33,Visit us at the @NYAutoShow to learn about our partnership with the @Petfinder_fnd and visit  to learn about our pet accessories #VolvoDogs,27,5,1
867,979791386840043520,238785,490,2018-03-30 18:44:04,Come by the Volvo Car USA booth at the @NYAutoShow to learn about our partnership with the @Petfinder_fnd and visit  #VolvoDogs,39,4,2
868,985314443918749702,238785,490,2018-04-15 00:30:44,Thank you for the birthday acknowledgement,49,4,0
869,983548826115018752,238785,490,2018-04-10 03:34:48,"@glenndphilp Hi Glenn, Care by Volvo can be ordered through the Care by Volvo App or directly from our website. At this time just the XC40 is available for ordering for Care by Volvo.",0,0,0
870,981506459253997568,238785,490,2018-04-04 12:19:10,Introducing the new #XC40. The car you can subscribe to at,44,20,6
871,984491915767771136,238785,490,2018-04-12 18:02:18,It’s just a simple waste basket. 	The new #XC40. Designed with every thing in mind. 	Discover more at,41,10,2
872,983053840810496000,238785,490,2018-04-08 18:47:54,"Welcome to the U.S., Zlatan. We’re here for you whenever you need to drive more than 40 meters @Ibra_official #zLAtan",140,38,5
873,984217251510398981,238785,490,2018-04-11 23:50:53,"@chasemayo Hello Chase, we apologize for this experience. If you can kindly DM us your contact information we will be happy to assist further.",2,0,0
874,981947579750670342,238785,490,2018-04-05 17:32:01,"@jbb2425 Hi Jan, can you DM us your order details and contact information. We can provide you an update on your order.",0,0,0
875,984602042424545283,238785,490,2018-04-13 01:19:54,@aaronstew12 Congratulations on your XC40 Aaron! Enjoy your Swede ride.,2,0,1
876,980991408042594305,238785,490,2018-04-03 02:12:32,"@TwinTurboTerror Hi Eric, Care by Volvo is only 15,000 miles a year, there are no other mileage options.",0,0,0
877,979831942412734466,238785,490,2018-03-30 21:25:14,"@bgetsug Hi Ben, we are sorry to hear of this experience with your XC60. Please contact our Customer Care team so we can better assist you at 1-800-458-1552 or vcnacare@volvoforlife.com",1,0,0
878,984231392723730433,238785,490,2018-04-12 00:47:04,It’s just a simple door bin. 	The new #XC40. Designed with every thing in mind.,46,17,0
879,978670759504736258,238785,490,2018-03-27 16:31:06,The new 2019 #XC40 has arrived in #NYC for the @NYAutoShow. See it in person March 30-April 8.  #NYIAS  Learn more about the XC40 at,42,10,1
880,979101369209688064,238785,490,2018-03-28 21:02:11,Come see the #XC60 the 2018 #WorldCar of The Year at the #NYIAS #WCOTY,90,20,4
881,976921291834974209,238785,490,2018-03-22 20:39:20,"@blairc15 Hello Chris, we are sorry to learn you are having this experience with your XC90. Please contact us so we can be of further assistance at 1-800-458-1552 or vcnacare@volvoforlife.com",0,0,0
882,977892751751700480,238785,490,2018-03-25 12:59:35,"@13KellyDonovan Hi Kelly, please contact our Customer Care team so they can best assist you with Homelink. They can be reached Monday through Friday 8am to 9pm at vcnacare@volvoforlife.com or 1-800-458-1552.",0,0,0
883,978283734976876547,238785,490,2018-03-26 14:53:12,"@stryda03 Hello Dave, we apologize for any delay. If you can kindly DM us your contact information we can have our concierge reach you today.",0,0,0
884,977893276719243271,238785,490,2018-03-25 13:01:40,@Feddersticks We are glad you are really enjoying your XC90. We wish you many more happy and safe miles in it.,1,0,1
885,979001654933639168,238785,490,2018-03-28 14:25:58,"@SherryVogel Hello Sherry, we are sorry to hear of this experience. Please contact our Customer Care team to best assist you further with your XC90 at 1-800-458-1552 or vcnacare@volvoforlife.com",1,0,1
886,979002428891820032,238785,490,2018-03-28 14:29:02,"@BSteve_O1904 Hi Brian, the XC40 is available for Overseas Delivery.",1,0,0
887,979463346696093700,238785,490,2018-03-29 21:00:34,"@t_jern @volvocars Hi Tracie, we are sorry you are having this experience. Please contact our Customer Care team to best assist you at 1-800-458-1552 or vcnacare@volvoforlife.com",1,0,0
888,979402693411266567,238785,490,2018-03-29 16:59:33,The new #V60 will be available via #CarebyVolvo the revolutionary subscription service with one monthly flat-fee.  Just announced at the #NYIAS,69,18,0
889,977330105583316997,238785,490,2018-03-23 23:43:49,What a place to watch the world go by. The XC90 lets you travel everywhere in luxury.,44,16,2
890,976304443149840386,238785,490,2018-03-21 03:48:12,"@_JamesWard Hi James, we are sorry you are having trouble getting in contact with us. We can be reached at vcnacare@volvoforlife.com. Also please DM us your contact information and we can reach out to you directly.",1,0,0
891,978285230908985344,238785,490,2018-03-26 14:59:09,@ccupp We are sorry to hear about this Catherine. If you can kindly DM us your contact information or contact our Customer Care team at 1-800-458-1552 we will be happy to assist you further.,0,0,0
892,979463048929914881,238785,490,2018-03-29 20:59:23,"@BrianMSTL Hi Brian, for the Momentum and R-Design this is the only trim available at this time.",2,0,1
893,976483336775524353,238785,490,2018-03-21 15:39:04,Welcoming the arrival of #Spring with help from the newest addition the Volvo family. The new #XC40 is officially beginning to arrive in local dealerships.,40,9,2
894,976538495626956801,238785,490,2018-03-21 19:18:15,"@MattSolo130 Hello Peter, we are sorry to hear about this. We will have someone from our Customer Care team reach out to you to assist further. Thank you for reaching out to us.",1,0,0
895,978976596320243713,238785,490,2018-03-28 12:46:23,"SVP OF #VOLVO CARS AMERICAS, ANDERS GUSTAFSSON 	ACCEPTING THE 2018 WORLD CAR OF THE YEAR AWARD FOR THE #XC60 #NYIAS #WCOTY",72,21,1
896,978974673634553862,238785,490,2018-03-28 12:38:45,We are proud to announce the #XC60 is the 2018 World Car Of The Year 🏆 #WCOTY #NYIAS,621,156,17
897,978370413079224320,238785,490,2018-03-26 20:37:38,"@Dr_BS Hello Brian, congratulations on your XC40! These mats can be ordered through your authorized Volvo dealership.",1,0,0
898,976629457279750145,238785,490,2018-03-22 01:19:42,"We may not have any #Spring weather yet, but we can have a little fun anyway in the #V90CrossCountry",80,12,3
899,973653327568408577,238785,490,2018-03-13 20:13:37,"‘The #VolvoS90 feels premium in its bones: light, stiff, unshakable, ineffably modern. It certainly wowed the neighbors.’   - @WSJ",42,7,2
900,970319664793481218,238785,490,2018-03-04 15:26:50,You’ll have to see it to believe it. Visit us online to explore the #newV60 and all it has to offer.,42,9,1
901,975479609033621505,238785,490,2018-03-18 21:10:36,"@JZaleski Hello Justin, we are sorry you are having this experience. If you can please DM us we will be happy to assist you.",1,0,0
902,970683605059035140,238785,490,2018-03-05 15:33:00,Learn more about #CarebyVolvo and the new #XC40 at,25,2,2
903,969984582048153602,238785,490,2018-03-03 17:15:20,"@stryda03 Yes Dave, connectivity will be available in the XC40 with Sensus Connect.",1,0,0
904,974739637456515075,238785,490,2018-03-16 20:10:14,@maybeezz The ad is correct - we have exciting news! The offer has been extended.  Visit your local dealer and ask about offers on the V90 Cross Country. Have a great weekend.,1,0,1
905,972213843953946631,238785,490,2018-03-09 20:53:37,"Alexandra Scott of @AlexsLemonade has been named one of @HuffPost's 16 Girls Who Changed The World.  She continues to inspire us at Volvo every day.   Learn about fighting childhood cancer, one cup at a time at",32,6,0
906,969639787668889601,238785,490,2018-03-02 18:25:15,Get a closer look at the Scandinavian craftsmanship that makes up the sleek and elegant features of the #newV60,43,11,3
907,973394880964722688,238785,490,2018-03-13 03:06:39,We are at the @TombRaiderMovie premiere with Lara Croft and the new #XC40 #TombRaider in cinemas March 16,20,4,0
908,971558486910881792,238785,490,2018-03-08 01:29:28,"@Mollywood_247 Hi Molly, The offer has been extended. Thank you!",0,0,0
909,970358608377630721,238785,490,2018-03-04 18:01:35,"@twilsonTNteach Hi Tammy we are sorry to hear of this experience. If you can kindly DM us your contact information, one of our Customer Care representatives will reach out to you to assist you further.",1,0,0
910,971850937349365760,238785,490,2018-03-08 20:51:34,@JunoKFofrie @hulu The offer has been extended,1,0,0
911,971572168436977664,238785,490,2018-03-08 02:23:50,"@JamesBaldiga Hello James, we are working directly with the customer to resolve this matter quickly.",1,0,0
912,976302269997002752,238785,490,2018-03-21 03:39:34,The #xc40 is keeping an eye out for #spring,64,10,2
913,975140897015951362,238785,490,2018-03-17 22:44:41,@notstilettoshy Congratulations on the milestone!,1,0,0
914,970321520110260229,238785,490,2018-03-04 15:34:12,@DBell72333786 @cgautomotive It is absolutely crystal! And it’s made by @orrefors,5,1,0
915,975200222837182465,238785,490,2018-03-18 02:40:26,Come rain or shine (or snow) the new #XC40 has begun to arrive in dealers! 	Locate your nearest dealer at,93,21,2
916,968663062961180672,238785,490,2018-02-28 01:44:05,@KyKen341 If you contact our Customer Care team they can remove you from any future mailings. Please contact us at 1-800-458-1552 or vcnacare@volvoforlife.com,1,0,0
917,974738916153667584,238785,490,2018-03-16 20:07:22,The XC40 has arrived in dealers! Find your local dealer at,57,8,2
918,971894647797805056,238785,490,2018-03-08 23:45:15,"@RafaelMontelong Hi Rafael, we are sorry to hear of what are you experiencing with your S90. If you can kindly DM us your contact information we will have someone reach out to you about this concern.",1,0,1
919,962027688482414592,238785,490,2018-02-09 18:17:29,Learn about the #VolvoDogs partnership with @Petfinder_fnd at  #volvodogs #cas18,13,1,0
920,964174162637082624,238785,490,2018-02-15 16:26:48,"Wherever your destination, extra space in the #newV60 means you’re ready for anything.",34,6,2
921,962028876892377088,238785,490,2018-02-09 18:22:12,"Come meet Gustaf, the #Volvo Spokesmoose on location with a show stopping bursting blue #VolvoV90 at the @ChiAutoShow #CAS18",69,19,3
922,962028048013918210,238785,490,2018-02-09 18:18:54,The 2018 #VolvoXC60 is the proud winner of the 2018 North American Utility Vehicle of the Year #nactoy come see it in person in #chicago #CAS18,31,8,1
923,962437589713211392,238785,490,2018-02-10 21:26:17,So far at #CAS18 8 #volvodogs have been adopted through our partnership with @Petfinder_fnd like Clark here.  Learn more at,21,7,1
924,962511711352905728,238785,490,2018-02-11 02:20:49,"@eric_maldon Hi Eric, You can order a dog harness on  and have it shipped to your home.",2,0,0
925,962211217275318272,238785,490,2018-02-10 06:26:45,We partnered with @Petfinder_fnd to find homes for dogs at the @ChiAutoShow #cas18 and we are donating $10 from every pet accessory sale to petfinder.  Learn more at  #volvodogs,44,10,0
926,967454104820752384,238785,490,2018-02-24 17:40:07,Volvo is making life less complicated with the new #XC40 at #createcultivatela,175,29,8
927,962094695378759680,238785,490,2018-02-09 22:43:44,"@OhDonnnna Hello Donna, we are sorry for the experience you had. Have you been in contact with our Customer Service team to help further?",1,0,1
928,963113450808467457,238785,490,2018-02-12 18:11:55,"@OhDonnnna Hello Donna, you can reach us at 1-800-458-1552 or vcnacare@volvoforlife.com",1,1,0
929,964293311103107072,238785,490,2018-02-16 00:20:15,@Ulshx5 @volvocars We are so glad our Overseas Delivery team was able to help.,1,0,0
930,964512719595622401,238785,490,2018-02-16 14:52:06,Enjoy more than just the drive in the #newV60. Coming soon. Discover more at,47,6,0
931,966369512386908160,238785,490,2018-02-21 17:50:20,Introducing the #NewV60 designed for a new era.,55,12,0
932,963987358734540800,238785,490,2018-02-15 04:04:30,"@Ulshx5 Hello RK Ulsh, we are sorry for this experience you are having. Please contact our Customer Care team as they will be best able to assist you at 1-800-458-1552 or vcnacare@volvoforlife.com",1,0,0
933,962511116449538048,238785,490,2018-02-11 02:18:27,Booth goals. #CAS18 #VolvoXC90 #XC40,100,20,5
934,962385036082401280,238785,490,2018-02-10 17:57:27,Keep your copilot safe. For every pet accessory sold we’ll donate $10 to the @Petfinder_fnd. Learn more at  #CAS18 #VolvoXC40 #VolvoDogs,37,11,0
935,962211357612486656,238785,490,2018-02-10 06:27:19,Test your reaction at the Volvo booth at @ChiAutoShow #cas18,17,4,1
936,966648373158858752,238785,490,2018-02-22 12:18:26,Say hello to our versatile and dynamic #newV60 – designed with you in mind and elegantly crafted to enhance every adventure. Coming early 2019.,71,19,2
937,966415043440070656,238785,490,2018-02-21 20:51:16,"It’s here. Welcome to a new generation of elegance, sport, and versatility. The #newV60, available early 2019.",124,16,4
938,964666885852844032,238785,490,2018-02-17 01:04:42,"@mattmoneysmith we are so thankful to hear that your daughter is okay. The safety and engineering that goes into our vehicles is to do exactly that, protect our passengers.",3,0,0
939,955481990169550848,238785,490,2018-01-22 16:47:13,#VolvoOverseasDelivery Program gives you the chance to pick up your car in Sweden while enjoying the vacation of a lifetime. #visitsweden	Discover more about this exciting program at,54,9,2
940,961950804088426496,238785,490,2018-02-09 13:11:58,"@somshahapurkar Hello Som, we are sorry to hear of this service experience you are having. We would recommend reaching out to our Customer Care team to best assist you at 1-800-458-1552 or at vcnacare@volvoforlife.com",0,0,0
941,955523868977922054,238785,490,2018-01-22 19:33:37,"@cmarriotti Hello Chad, Care by Volvo is not available through the Overseas Delivery program.",1,0,1
942,961630045595947008,238785,490,2018-02-08 15:57:23,"Hey #Chicago, we’ve arrived.  Come see us at the 2018 Chicago Auto Show this weekend #CAS18",58,16,0
943,958114064722427905,238785,490,2018-01-29 23:06:08,"@rjcsport Hi RJC, can you DM us some more information on your V90 order?  We will be happy to assist you further.",0,0,0
944,956340289630867456,238785,490,2018-01-25 01:37:47,"@mstelmas Hello Michael, the next show the XC40 will be at the Chicago Auto Show. We apologize for any inconvenience.",1,0,0
945,958337755288866817,238785,490,2018-01-30 13:55:00,Let it Snow 🌨,78,17,4
946,959770099229122561,238785,490,2018-02-03 12:46:37,With its attention to detail... it brings craftsmanship to a new level of quality. 	Discover limited time offers on the V90 Cross Country this Presidents’ Day at,25,5,1
947,955910854888906752,238785,490,2018-01-23 21:11:22,Discover #VolvoOverseasDelivery a unique way to explore the captivating country of Sweden in your new Volvo. Learn more about this exclusive trip at  #visitsweden,42,11,3
948,961949616232116225,238785,490,2018-02-09 13:07:15,"@jrspeer Hi John, we are sorry you are having this experience with the remote start. We would recommend contacting our Customer Care team to best assist you at vcnacare@Volvoforlife.com or 1-800-458-1552",0,0,0
949,955549230453657600,238785,490,2018-01-22 21:14:24,"@cmarriotti Hi Chad, we understand but we are excited for you to take delivery of your XC40 as well with Care by Volvo.",1,0,0
950,960921451741286400,238785,490,2018-02-06 17:01:41,"If you’re not in the market to buy a car, subscribe to one. Introducing the #XC40 with #CarebyVolvo Discover more at",55,7,3
951,956302019094024192,238785,490,2018-01-24 23:05:43,"@bucknut25 Hello Dyer, we are sorry you are having this experince with your Volvo. We would recommend contacting our Customer Care team to best assist you at 1-800-458-1552 or vcnacare@volvoforlife.com",1,0,0
952,956699761721081856,238785,490,2018-01-26 01:26:12,"@agutie001 Hello Alda, can you DM us your contact information and we can have one of our Customer Care team members contact you to assist you further.",1,0,1
953,957242397708181505,238785,490,2018-01-27 13:22:26,"@isaaclkoval takes us on a road trip, with him and his #VolvoXC90 to Silver Falls State Park in Oregon, a personal favorite from his childhood.",78,11,3
954,960528875531972609,238785,490,2018-02-05 15:01:44,"@jh32488 Hello James, My Volvo Magazine has 2 issues annually. The next issue has not been sent yet. You can reach our Customer Care team at 1-800-458-1552 or at vcnacare@volvoforlife.com",0,0,2
955,957043923922321408,238785,490,2018-01-27 00:13:47,"@MarshaNewman16 Hello Marsha, we are sorry to hear of this experience. Please contact our Customer Care team to best assist you at 1-800-458-1552 or vcnacare@volvoforlife.com",2,0,0
956,959077950749540352,238785,490,2018-02-01 14:56:16,We are honored the 2018 #VolvoXC60 is the winner of the 2018 North American Utility Vehicle of the Year Award. 	View current Presidents’ Day offers on,84,18,4
957,960686491411337221,238785,490,2018-02-06 01:28:02,"@Shentastic6 Hello Krystal, we are sorry to hear of this experience. We would recommend contacting our Customer Care team to best assist you. They can be reached at 1-800-458-1552 or vcnacare@volvoforlife.com",0,0,1
958,962027176286568453,238785,490,2018-02-09 18:15:27,"Safety worth barking about. With every pet accessory sold, #Volvo will donate $10 to @Petfinder_fnd 	Learn more at  	#VolvoDogs #CAS18",33,10,0
959,950567835977347073,238785,490,2018-01-09 03:20:07,"@dannylee114 Hello Danny, we are sorry for this experience. We would recommend contacting our Customer Care team to best assist you at vcnacare@volvoforlife.com or 1-800-458-1552",1,0,1
960,954158172025049094,238785,490,2018-01-19 01:06:50,"@chitraelizabeth Hi Chitra, we apologize about this. We are currently working to have his corrected.",0,0,1
961,950819031778553856,238785,490,2018-01-09 19:58:17,"No matter where 2018 takes you, the new #XC40 will make every journey a fun adventure. Pre-order your perfect co-pilot today and be one of the first to have this innovative, functional car.",55,14,4
962,950540254028685312,238785,490,2018-01-09 01:30:31,Thank you @carsdotcom for nominating the #VolvoXC60 for the #Carsbestof awards,21,6,0
963,954349844595986432,238785,490,2018-01-19 13:48:28,Great news Gretchen. Drive safe and keep warm!,13,2,0
964,953321429914849280,238785,490,2018-01-16 17:41:55,Volvo Cars President and CEO Håkan Samuelsson on winning Disruptor of the Year at the 2018 @roadshow Shift Awards by @CNET at #NAIAS,34,12,0
965,954348567430393856,238785,490,2018-01-19 13:43:24,"To design the new #XC40, we looked to architecture, art and culture for inspiration.		Learn more about this revolutionary car at",53,11,3
966,954378518724476928,238785,490,2018-01-19 15:42:25,@chitraelizabeth Here is a direct link to see what is included for the momentum model,0,0,0
967,954350445610323969,238785,490,2018-01-19 13:50:51,"@chitraelizabeth Hi Chitra.  They do, they are within available packages. Learn more at  and you can build your car to see which features are in all the packages and build it exactly to your specifications. Let us know if you need any help!",0,0,0
968,951878347264577543,238785,490,2018-01-12 18:07:37,Reminiscing on warm days with sunny skies from the safety and comfort of the #VolvoXC60.,27,6,1
969,955129382414233600,238785,490,2018-01-21 17:26:04,"@jbb2425 Hi Jan, the XC40 will arrive at dealerships this Spring.",0,0,0
970,954376686765821955,238785,490,2018-01-19 15:35:08,@h_emara @sanjayraman @chitraelizabeth @hakan_samuel We are working quickly to resolve the issue.,0,0,0
971,954378797897408512,238785,490,2018-01-19 15:43:31,@chitraelizabeth And the same for r design,1,0,0
972,951569827608584192,238785,490,2018-01-11 21:41:40,"@neilpconnors Hi Neil, our Customer Care team can best assist you with this question. Please contact us at 1-800-458-1552 or vcnacare@volvoforlife.com",0,0,2
973,951895558028918784,238785,490,2018-01-12 19:16:01,The #V90CrossCountry is one of the top cars from @auto123 for playing in the snow 🚙🌨,23,6,0
974,953793995850895361,238785,490,2018-01-18 00:59:43,"@LeynaNguyenTV Hello Leyna, we are sorry to hear you are experiencing this with your XC90. If you can kindly DM us with your contact information, we will have our Customer Care team contact you to assist you further.",2,0,2
975,953017901040226304,238785,490,2018-01-15 21:35:48,"Where innovative safety, design, and handling come first. This is the 2018 #VolvoXC60.  The 2018 North American Utility Vehicle of the Year learn more about the #XC60 at",55,17,2
976,951938370674020353,238785,490,2018-01-12 22:06:08,"@trishskee Hi Trish, thank you for your interest in the XC40. Test drives will be available this Spring.",2,0,0
977,954376608118378496,238785,490,2018-01-19 15:34:49,"@chitraelizabeth Thank you, yes, we are working quickly to resolve the issue.",0,0,0
978,952891009394003968,238785,490,2018-01-15 13:11:35,We are honored to announce the 2018 #VolvoXC60 as the proud winner of the 2018 North American Utility Vehicle of the Year Award. #NACTOY,269,75,13
979,949802540333502465,238785,490,2018-01-07 00:39:06,"@aliciakoglesby Hi Alicia, we are sorry to hear about your circumstances. Please contact our roadside assistance team at 1-800-638-6586 to best assist you.",2,0,1
980,943231713840455680,238785,490,2017-12-19 21:28:59,@andersonjustin We are sorry for this experience Justin. Please contact our Customer Care team to best assist you at 1-800-458-1552 or vcnacare@volvoforlife.com,0,0,0
981,949729527760121859,238785,490,2018-01-06 19:48:59,@kolding We are sorry to learn of this experience you are having with your. Volvo. We would recommend contacting our Customer Care team to best assist you. They can be reached at 1-800-458-1552 or vcnacare@volvoforlife.com,1,0,1
982,943511851672973312,238785,490,2017-12-20 16:02:09,"@milamookie Hi Tuan, with Care by Volvo, the vehicles are already pre-configured. There is no white roof option for  he momentum with this subscription.",1,0,0
983,949250052245114881,238785,490,2018-01-05 12:03:43,"No worries, your #VolvoXC90 will be warm and cozy before you know it. Start it before you leave the house all from the palm of your hand with the #VolvoOnCall app.",65,13,8
984,948373298760560641,238785,490,2018-01-03 01:59:49,"@mrmedina @volvocars Hi Alex, you can now order an XC40 through Care by Volvo. Vehicles will be delivered this Spring.",2,0,1
985,948645578585640961,238785,490,2018-01-03 20:01:45,@FLlovesTrump79 We are sorry to hear about this. We would recommend visiting your local Volvo dealership to have this checked by a technician.,1,0,0
